product_id,rating,review_summary
PROD-001,5,"The Nike Air Max 270 Running Shoes from Nike exceeded my expectations. Experience peak performance with the Nike Air Max 270 Running Shoes, featuring innovative design for maximum comfort and support. Worth every penny of the $150.0."
PROD-002,2,Disappointed with this Clothing item. Elevate your wardrobe with these premium Levi's 501 Original Fit Jeans from Levi's. Wouldn't recommend at this price point.
PROD-003,5,The quality of this Zara product is outstanding. Captivate any room in this stunning Zara Floral Print Midi Dress by Zara. I would buy it again.
PROD-004,4,The Apple Watch Series 9 GPS is good but not great. Discover the exceptional quality of Apple Watch Series 9 GPS by Apple. There are better options available.
PROD-005,4,I've been using this Footwear for a month now and I'm impressed. Discover the exceptional quality of Adidas Superstar Kids Sneakers by Adidas. Highly recommended!
PROD-006,3,Solid performance from the H&M Oversized Knit Sweater. Stay cozy and stylish in this premium H&M Oversized Knit Sweater from H&M. Good value for the price.
PROD-007,4,The Samsung Galaxy Buds2 Pro Wireless Earbuds is good but not great. Discover the exceptional quality of Samsung Galaxy Buds2 Pro Wireless Earbuds by Samsung. There are better options available.
PROD-008,4,Solid performance from the Ralph Lauren Classic Fit Polo Shirt. Discover the exceptional quality of Ralph Lauren Classic Fit Polo Shirt by Ralph Lauren. Good value for the price.
PROD-009,2,Disappointed with this Footwear item. Step out in confidence with these trendsetting Converse Chuck Taylor All Star High Top by Converse. Wouldn't recommend at this price point.
PROD-010,5,The Uniqlo Uniqlo Ultra Light Down Jacket is exactly what I needed. Brave the elements in style with the Uniqlo Ultra Light Down Jacket from Uniqlo. Perfect fit for my lifestyle.
PROD-011,3,Solid performance from the Michael Kors Jet Set Travel Tote. Carry your essentials in sophisticated style with the Michael Kors Jet Set Travel Tote by Michael Kors. Good value for the price.
PROD-012,3,Not entirely satisfied with the Gap Kids Denim Jacket. Discover the exceptional quality of Gap Kids Denim Jacket by Gap. It's decent but overpriced for what it offers.
PROD-013,4,Solid performance from the Sony WH-1000XM4 Wireless Headphones. Discover the exceptional quality of Sony WH-1000XM4 Wireless Headphones by Sony. Good value for the price.
PROD-014,3,The Patagonia Better Sweater Fleece Jacket is good but not great. Brave the elements in style with the Patagonia Better Sweater Fleece Jacket from Patagonia. There are better options available.
PROD-015,2,Disappointed with this Footwear item. Step out in confidence with these trendsetting Vans Old Skool Sneakers by Vans. Wouldn't recommend at this price point.
PROD-016,3,Not entirely satisfied with the Lululemon Align High-Rise Pant. Discover the exceptional quality of Lululemon Align High-Rise Pant by Lululemon. It's decent but overpriced for what it offers.
PROD-017,4,I've been using this Accessories for a month now and I'm impressed. Shield your eyes in style with these iconic Ray-Ban Aviator Classic Sunglasses by Ray-Ban. Highly recommended!
PROD-018,3,The Champion Reverse Weave Hoodie is good but not great. Stay cozy and stylish in this premium Champion Reverse Weave Hoodie from Champion. There are better options available.
PROD-019,4,This Carter's Baby 3-Pack Bodysuit Set is a game-changer in the Clothing space. Discover the exceptional quality of Carter's Baby 3-Pack Bodysuit Set by Carter's. Great value for money.
PROD-020,2,Disappointed with this Footwear item. Conquer any terrain with the rugged yet refined Timberland 6-Inch Premium Waterproof Boots from Timberland. Wouldn't recommend at this price point.
PROD-021,5,The quality of this Under Armour product is outstanding. Discover the exceptional quality of Under Armour HeatGear Tech T-Shirt by Under Armour. I would buy it again.
PROD-022,4,I've been using this Accessories for a month now and I'm impressed. Carry your essentials in sophisticated style with the Kate Spade New York Crossbody Bag by Kate Spade. Highly recommended!
PROD-023,4,This Sony WH-1000XM4 Wireless Headphones is a game-changer in the Electronics space. Discover the exceptional quality of Sony WH-1000XM4 Wireless Headphones by Sony. Great value for money.
PROD-024,2,Disappointed with this Clothing item. Brave the elements in style with the Patagonia Better Sweater Fleece Jacket from Patagonia. Wouldn't recommend at this price point.
PROD-025,5,Absolutely love my new Vans Old Skool Sneakers! Step out in confidence with these trendsetting Vans Old Skool Sneakers by Vans. Best purchase I've made this year.
PROD-026,5,The Lululemon Lululemon Align High-Rise Pant is exactly what I needed. Discover the exceptional quality of Lululemon Align High-Rise Pant by Lululemon. Perfect fit for my lifestyle.
PROD-027,2,Not entirely satisfied with the Ray-Ban Aviator Classic Sunglasses. Shield your eyes in style with these iconic Ray-Ban Aviator Classic Sunglasses by Ray-Ban. It's decent but overpriced for what it offers.
PROD-028,3,Solid performance from the Champion Reverse Weave Hoodie. Stay cozy and stylish in this premium Champion Reverse Weave Hoodie from Champion. Good value for the price.
PROD-029,4,I've been using this Clothing for a month now and I'm impressed. Discover the exceptional quality of Carter's Baby 3-Pack Bodysuit Set by Carter's. Highly recommended!
PROD-030,4,I've been using this Footwear for a month now and I'm impressed. Conquer any terrain with the rugged yet refined Timberland 6-Inch Premium Waterproof Boots from Timberland. Highly recommended!
PROD-031,4,I've been using this Clothing for a month now and I'm impressed. Discover the exceptional quality of Under Armour HeatGear Tech T-Shirt by Under Armour. Highly recommended!
PROD-032,4,I've been using this Accessories for a month now and I'm impressed. Carry your essentials in sophisticated style with the Kate Spade New York Crossbody Bag by Kate Spade. Highly recommended!
PROD-033,5,The Sony WH-1000XM4 Wireless Headphones from Sony exceeded my expectations. Discover the exceptional quality of Sony WH-1000XM4 Wireless Headphones by Sony. Worth every penny of the $349.99.
PROD-034,3,The Patagonia Better Sweater Fleece Jacket is good but not great. Brave the elements in style with the Patagonia Better Sweater Fleece Jacket from Patagonia. There are better options available.
PROD-035,5,The Vans Old Skool Sneakers from Vans exceeded my expectations. Step out in confidence with these trendsetting Vans Old Skool Sneakers by Vans. Worth every penny of the $65.0.
PROD-036,4,Solid performance from the Lululemon Align High-Rise Pant. Discover the exceptional quality of Lululemon Align High-Rise Pant by Lululemon. Good value for the price.
PROD-037,5,The quality of this Ray-Ban product is outstanding. Shield your eyes in style with these iconic Ray-Ban Aviator Classic Sunglasses by Ray-Ban. I would buy it again.
PROD-038,3,Solid performance from the Champion Reverse Weave Hoodie. Stay cozy and stylish in this premium Champion Reverse Weave Hoodie from Champion. Good value for the price.
PROD-039,5,The Carter's Baby 3-Pack Bodysuit Set from Carter's exceeded my expectations. Discover the exceptional quality of Carter's Baby 3-Pack Bodysuit Set by Carter's. Worth every penny of the $24.0.
PROD-040,4,This Timberland 6-Inch Premium Waterproof Boots is a game-changer in the Footwear space. Conquer any terrain with the rugged yet refined Timberland 6-Inch Premium Waterproof Boots from Timberland. Great value for money.
PROD-041,4,The Under Armour HeatGear Tech T-Shirt is good but not great. Discover the exceptional quality of Under Armour HeatGear Tech T-Shirt by Under Armour. There are better options available.
PROD-042,4,I've been using this Accessories for a month now and I'm impressed. Carry your essentials in sophisticated style with the Kate Spade New York Crossbody Bag by Kate Spade. Highly recommended!
PROD-043,3,Not entirely satisfied with the Sony WH-1000XM4 Wireless Headphones. Discover the exceptional quality of Sony WH-1000XM4 Wireless Headphones by Sony. It's decent but overpriced for what it offers.
PROD-044,4,I've been using this Clothing for a month now and I'm impressed. Brave the elements in style with the Patagonia Better Sweater Fleece Jacket from Patagonia. Highly recommended!
PROD-045,5,Absolutely love my new Vans Old Skool Sneakers! Step out in confidence with these trendsetting Vans Old Skool Sneakers by Vans. Best purchase I've made this year.
PROD-046,5,The Lululemon Align High-Rise Pant from Lululemon exceeded my expectations. Discover the exceptional quality of Lululemon Align High-Rise Pant by Lululemon. Worth every penny of the $128.0.
PROD-047,4,I've been using this Accessories for a month now and I'm impressed. Shield your eyes in style with these iconic Ray-Ban Aviator Classic Sunglasses by Ray-Ban. Highly recommended!
PROD-048,5,The Champion Reverse Weave Hoodie from Champion exceeded my expectations. Stay cozy and stylish in this premium Champion Reverse Weave Hoodie from Champion. Worth every penny of the $70.0.
PROD-049,2,Disappointed with this Clothing item. Discover the exceptional quality of Carter's Baby 3-Pack Bodysuit Set by Carter's. Wouldn't recommend at this price point.
PROD-050,4,This Timberland 6-Inch Premium Waterproof Boots is a game-changer in the Footwear space. Conquer any terrain with the rugged yet refined Timberland 6-Inch Premium Waterproof Boots from Timberland. Great value for money.
